{
  "schema": "deeplus.accessor-property-forwarding-evidence/r100",
  "revision": "r100-accessor-property-forwarding-trace-r1",
  "status": "LOCAL_DESIGN_STATIC_EVIDENCE_OVERLAY",
  "feature_ids": [
    "accessor_property_colon_equals_surface",
    "accessor_visibility_restored_law",
    "accessor_visibility_surface_phase_a",
    "instance_extension_property",
    "member_forwarding",
    "property_default_accessor",
    "property_value_admissibility",
    "simplified_class_member_surface"
  ],
  "evidence_entries": [
    {
      "evidence_key": "R100:accessor_property_colon_equals_surface:STATIC_SEMANTICS:STRUCTURAL",
      "class": "CONTRACT_RULE_ID",
      "path": "spec/contracts/accessor-property-forwarding-r100.json",
      "locator_kind": "REGISTRY_ID",
      "locator": "APMF-R001",
      "stage_role": "STATIC_SEMANTICS"
    },
    {
      "evidence_key": "R100:accessor_property_colon_equals_surface:CONFORMANCE_TESTS:POSITIVE",
      "class": "ACCEPTANCE_CASE_SET",
      "path": "spec/contracts/accessor-property-forwarding-r100.json",
      "locator_kind": "JSON_POINTER",
      "locator": "/acceptance_bindings/accessor_property_colon_equals_surface/POSITIVE",
      "stage_role": "CONFORMANCE_TESTS:POSITIVE"
    },
    {
      "evidence_key": "R100:accessor_property_colon_equals_surface:CONFORMANCE_TESTS:BOUNDARY",
      "class": "ACCEPTANCE_CASE_SET",
      "path": "spec/contracts/accessor-property-forwarding-r100.json",
      "locator_kind": "JSON_POINTER",
      "locator": "/acceptance_bindings/accessor_property_colon_equals_surface/BOUNDARY",
      "stage_role": "CONFORMANCE_TESTS:BOUNDARY"
    },
    {
      "evidence_key": "R100:accessor_property_colon_equals_surface:CONFORMANCE_TESTS:REJECT",
      "class": "ACCEPTANCE_CASE_SET",
      "path": "spec/contracts/accessor-property-forwarding-r100.json",
      "locator_kind": "JSON_POINTER",
      "locator": "/acceptance_bindings/accessor_property_colon_equals_surface/REJECT",
      "stage_role": "CONFORMANCE_TESTS:REJECT"
    },
    {
      "evidence_key": "R100:accessor_visibility_restored_law:DYNAMIC_LOWERING:STRUCTURAL",
      "class": "CONTRACT_RULE_ID",
      "path": "spec/contracts/accessor-property-forwarding-r100.json",
      "locator_kind": "REGISTRY_ID",
      "locator": "APMF-R002",
      "stage_role": "DYNAMIC_LOWERING"
    },
    {
      "evidence_key": "R100:accessor_visibility_restored_law:CONFORMANCE_TESTS:POSITIVE",
      "class": "ACCEPTANCE_CASE_SET",
      "path": "spec/contracts/accessor-property-forwarding-r100.json",
      "locator_kind": "JSON_POINTER",
      "locator": "/acceptance_bindings/accessor_visibility_restored_law/POSITIVE",
      "stage_role": "CONFORMANCE_TESTS:POSITIVE"
    },
    {
      "evidence_key": "R100:accessor_visibility_restored_law:CONFORMANCE_TESTS:BOUNDARY",
      "class": "ACCEPTANCE_CASE_SET",
      "path": "spec/contracts/accessor-property-forwarding-r100.json",
      "locator_kind": "JSON_POINTER",
      "locator": "/acceptance_bindings/accessor_visibility_restored_law/BOUNDARY",
      "stage_role": "CONFORMANCE_TESTS:BOUNDARY"
    },
    {
      "evidence_key": "R100:accessor_visibility_restored_law:CONFORMANCE_TESTS:REJECT",
      "class": "ACCEPTANCE_CASE_SET",
      "path": "spec/contracts/accessor-property-forwarding-r100.json",
      "locator_kind": "JSON_POINTER",
      "locator": "/acceptance_bindings/accessor_visibility_restored_law/REJECT",
      "stage_role": "CONFORMANCE_TESTS:REJECT"
    },
    {
      "evidence_key": "R100:accessor_visibility_surface_phase_a:STATIC_SEMANTICS:STRUCTURAL",
      "class": "CONTRACT_RULE_ID",
      "path": "spec/contracts/accessor-property-forwarding-r100.json",
      "locator_kind": "REGISTRY_ID",
      "locator": "APMF-R002",
      "stage_role": "STATIC_SEMANTICS"
    },
    {
      "evidence_key": "R100:accessor_visibility_surface_phase_a:CONFORMANCE_TESTS:POSITIVE",
      "class": "ACCEPTANCE_CASE_SET",
      "path": "spec/contracts/accessor-property-forwarding-r100.json",
      "locator_kind": "JSON_POINTER",
      "locator": "/acceptance_bindings/accessor_visibility_surface_phase_a/POSITIVE",
      "stage_role": "CONFORMANCE_TESTS:POSITIVE"
    },
    {
      "evidence_key": "R100:accessor_visibility_surface_phase_a:CONFORMANCE_TESTS:BOUNDARY",
      "class": "ACCEPTANCE_CASE_SET",
      "path": "spec/contracts/accessor-property-forwarding-r100.json",
      "locator_kind": "JSON_POINTER",
      "locator": "/acceptance_bindings/accessor_visibility_surface_phase_a/BOUNDARY",
      "stage_role": "CONFORMANCE_TESTS:BOUNDARY"
    },
    {
      "evidence_key": "R100:accessor_visibility_surface_phase_a:CONFORMANCE_TESTS:REJECT",
      "class": "ACCEPTANCE_CASE_SET",
      "path": "spec/contracts/accessor-property-forwarding-r100.json",
      "locator_kind": "JSON_POINTER",
      "locator": "/acceptance_bindings/accessor_visibility_surface_phase_a/REJECT",
      "stage_role": "CONFORMANCE_TESTS:REJECT"
    },
    {
      "evidence_key": "R100:instance_extension_property:DYNAMIC_LOWERING:STRUCTURAL",
      "class": "CONTRACT_RULE_ID",
      "path": "spec/contracts/accessor-property-forwarding-r100.json",
      "locator_kind": "REGISTRY_ID",
      "locator": "APMF-R009",
      "stage_role": "DYNAMIC_LOWERING"
    },
    {
      "evidence_key": "R100:instance_extension_property:CONFORMANCE_TESTS:POSITIVE",
      "class": "ACCEPTANCE_CASE_SET",
      "path": "spec/contracts/accessor-property-forwarding-r100.json",
      "locator_kind": "JSON_POINTER",
      "locator": "/acceptance_bindings/instance_extension_property/POSITIVE",
      "stage_role": "CONFORMANCE_TESTS:POSITIVE"
    },
    {
      "evidence_key": "R100:instance_extension_property:CONFORMANCE_TESTS:BOUNDARY",
      "class": "ACCEPTANCE_CASE_SET",
      "path": "spec/contracts/accessor-property-forwarding-r100.json",
      "locator_kind": "JSON_POINTER",
      "locator": "/acceptance_bindings/instance_extension_property/BOUNDARY",
      "stage_role": "CONFORMANCE_TESTS:BOUNDARY"
    },
    {
      "evidence_key": "R100:instance_extension_property:CONFORMANCE_TESTS:REJECT",
      "class": "ACCEPTANCE_CASE_SET",
      "path": "spec/contracts/accessor-property-forwarding-r100.json",
      "locator_kind": "JSON_POINTER",
      "locator": "/acceptance_bindings/instance_extension_property/REJECT",
      "stage_role": "CONFORMANCE_TESTS:REJECT"
    },
    {
      "evidence_key": "R100:member_forwarding:DYNAMIC_LOWERING:STRUCTURAL",
      "class": "CONTRACT_RULE_ID",
      "path": "spec/contracts/accessor-property-forwarding-r100.json",
      "locator_kind": "REGISTRY_ID",
      "locator": "APMF-R011",
      "stage_role": "DYNAMIC_LOWERING"
    },
    {
      "evidence_key": "R100:member_forwarding:CONFORMANCE_TESTS:POSITIVE",
      "class": "ACCEPTANCE_CASE_SET",
      "path": "spec/contracts/accessor-property-forwarding-r100.json",
      "locator_kind": "JSON_POINTER",
      "locator": "/acceptance_bindings/member_forwarding/POSITIVE",
      "stage_role": "CONFORMANCE_TESTS:POSITIVE"
    },
    {
      "evidence_key": "R100:member_forwarding:CONFORMANCE_TESTS:BOUNDARY",
      "class": "ACCEPTANCE_CASE_SET",
      "path": "spec/contracts/accessor-property-forwarding-r100.json",
      "locator_kind": "JSON_POINTER",
      "locator": "/acceptance_bindings/member_forwarding/BOUNDARY",
      "stage_role": "CONFORMANCE_TESTS:BOUNDARY"
    },
    {
      "evidence_key": "R100:member_forwarding:CONFORMANCE_TESTS:REJECT",
      "class": "ACCEPTANCE_CASE_SET",
      "path": "spec/contracts/accessor-property-forwarding-r100.json",
      "locator_kind": "JSON_POINTER",
      "locator": "/acceptance_bindings/member_forwarding/REJECT",
      "stage_role": "CONFORMANCE_TESTS:REJECT"
    },
    {
      "evidence_key": "R100:property_default_accessor:DYNAMIC_LOWERING:STRUCTURAL",
      "class": "CONTRACT_RULE_ID",
      "path": "spec/contracts/accessor-property-forwarding-r100.json",
      "locator_kind": "REGISTRY_ID",
      "locator": "APMF-R008",
      "stage_role": "DYNAMIC_LOWERING"
    },
    {
      "evidence_key": "R100:property_default_accessor:CONFORMANCE_TESTS:POSITIVE",
      "class": "ACCEPTANCE_CASE_SET",
      "path": "spec/contracts/accessor-property-forwarding-r100.json",
      "locator_kind": "JSON_POINTER",
      "locator": "/acceptance_bindings/property_default_accessor/POSITIVE",
      "stage_role": "CONFORMANCE_TESTS:POSITIVE"
    },
    {
      "evidence_key": "R100:property_default_accessor:CONFORMANCE_TESTS:BOUNDARY",
      "class": "ACCEPTANCE_CASE_SET",
      "path": "spec/contracts/accessor-property-forwarding-r100.json",
      "locator_kind": "JSON_POINTER",
      "locator": "/acceptance_bindings/property_default_accessor/BOUNDARY",
      "stage_role": "CONFORMANCE_TESTS:BOUNDARY"
    },
    {
      "evidence_key": "R100:property_default_accessor:CONFORMANCE_TESTS:REJECT",
      "class": "ACCEPTANCE_CASE_SET",
      "path": "spec/contracts/accessor-property-forwarding-r100.json",
      "locator_kind": "JSON_POINTER",
      "locator": "/acceptance_bindings/property_default_accessor/REJECT",
      "stage_role": "CONFORMANCE_TESTS:REJECT"
    },
    {
      "evidence_key": "R100:property_value_admissibility:DYNAMIC_LOWERING:STRUCTURAL",
      "class": "CONTRACT_RULE_ID",
      "path": "spec/contracts/accessor-property-forwarding-r100.json",
      "locator_kind": "REGISTRY_ID",
      "locator": "APMF-R006",
      "stage_role": "DYNAMIC_LOWERING"
    },
    {
      "evidence_key": "R100:property_value_admissibility:CONFORMANCE_TESTS:POSITIVE",
      "class": "ACCEPTANCE_CASE_SET",
      "path": "spec/contracts/accessor-property-forwarding-r100.json",
      "locator_kind": "JSON_POINTER",
      "locator": "/acceptance_bindings/property_value_admissibility/POSITIVE",
      "stage_role": "CONFORMANCE_TESTS:POSITIVE"
    },
    {
      "evidence_key": "R100:property_value_admissibility:CONFORMANCE_TESTS:BOUNDARY",
      "class": "ACCEPTANCE_CASE_SET",